{
  "$schema": "https://recursive-dev-loop.dev/schemas/guardrail-action.v1.schema.json",
  "schema_version": "1.0.0",
  "action_id": "act-unapproved-candidate",
  "created_at": "2026-08-27T13:05:00.000Z",
  "actor": { "kind": "dsh-agent", "id": "agent-local" },
  "input_trust": "trusted",
  "capability": "candidate_application",
  "tool": { "name": "dal", "operation": "policy-check" },
  "target": {
    "uri": "repo://tests/fixtures/proposals/proposed-hard-stop.json",
    "artifact_kind": "optimizer_proposal",
    "artifact_id": "prop-eval-safety",
    "sha256": "cccccccccccccccccccccccccccccccccccccccccccccccccccccccccccccccc"
  },
  "data": {
    "classification": "internal",
    "contains_personal_data": false,
    "redacted": true
  },
  "sandbox": { "mode": "read_only", "network": "denied", "writable_roots": [] },
  "budget": {
    "max_calls": 1,
    "max_duration_ms": 1000,
    "max_bytes_read": 4096,
    "max_bytes_written": 0,
    "max_network_requests": 0
  },
  "approval_ref": null
}
