{
  "$schema": "https://recursive-dev-loop.dev/schemas/guardrail-action.v1.schema.json",
  "schema_version": "1.0.0",
  "action_id": "act-allowed-write",
  "created_at": "2026-08-27T13:02:00.000Z",
  "actor": { "kind": "dsh-agent", "id": "agent-local" },
  "input_trust": "trusted",
  "capability": "write_local_evidence",
  "tool": { "name": "dal", "operation": "evaluation-run" },
  "target": {
    "uri": "repo://.dal/evaluations/fixture-output.json",
    "artifact_kind": null,
    "artifact_id": null,
    "sha256": null
  },
  "data": {
    "classification": "internal",
    "contains_personal_data": false,
    "redacted": true
  },
  "sandbox": {
    "mode": "isolated_write",
    "network": "denied",
    "writable_roots": ["repo://.dal/"]
  },
  "budget": {
    "max_calls": 1,
    "max_duration_ms": 1000,
    "max_bytes_read": 4096,
    "max_bytes_written": 4096,
    "max_network_requests": 0
  },
  "approval_ref": null
}
