{
  "$schema": "https://recursive-dev-loop.dev/schemas/guardrail-action.v1.schema.json",
  "schema_version": "1.0.0",
  "action_id": "act-network-request",
  "created_at": "2026-08-27T13:06:00.000Z",
  "actor": { "kind": "dsh-agent", "id": "agent-local" },
  "input_trust": "external",
  "capability": "read_local",
  "tool": { "name": "dal", "operation": "schema-validate" },
  "target": { "uri": "repo://schemas", "artifact_kind": null, "artifact_id": null, "sha256": null },
  "data": {
    "classification": "internal",
    "contains_personal_data": false,
    "redacted": true
  },
  "sandbox": { "mode": "read_only", "network": "unrestricted", "writable_roots": [] },
  "budget": {
    "max_calls": 1,
    "max_duration_ms": 1000,
    "max_bytes_read": 4096,
    "max_bytes_written": 0,
    "max_network_requests": 0
  },
  "approval_ref": null
}
